question,text
What was the trading post that preceded New York City called?,New Amsterdam
What nation founded New Amsterdam?,the Dutch Republic
In what year did New York become the largest city in the United States?,1790
When did the English take over the area from the Dutch?,1664
In what year did New York cease the be the capital of the United States?,1790
When was New York City established?,1624
New Amsterdam became the title of New York City in what past date?,1626
The English occupied New York City beginning on what date?,1664
New York City is the biggest city in the United States since what historical date?,1790
